path	tpath	twidth	theight	title	location	headline	description	creator	city	state	country	copyright	categories
assets/images/gallery/2023WJG0208_0087 b&w.jpg	assets/images/thumbnails/2023WJG0208_0087 b&w.jpg	300	200	Kit5chen, 1850s	Indian Range	Indian Range, 1012 Mount Airy Road, Davidsonville, Anne Arundel County, Maryland	Two-story house built on a large rural estate in a design at least inspired by the work of Downing and Davis. Constructed about 1850. Center-passage plan with drawing room on one side of the passage and dining room and library on the other. Rear/side service wing includes intermediate space possibly for staging food, carriage house, and kitchen on the extreme end. Two quarters in the attic above the carriage house and kitchen--one heated with a stove, the other not. Passage leads from teh unheated quarter to the second floor of the house. Leibrandt & McDowell Stove Company. Philadelphia & Baltimore.	Willie Graham	Anne Arundel Co.	MD	USA	WILLIE GRAHAM 2023	house,dwelling,a j davis,downing,davis and downing,frame,timber frame,gothic,kitchen,service,service wing,gothic revival,stove,leibrandt & mcdowell stove company,cast iron,cook,cokking,service
assets/images/gallery/2023WJG0706_2843.jpg	assets/images/thumbnails/2023WJG0706_2843.jpg	300	450	Street facade	Zuidzanstraat	Zuidzanstraat, Bruges, West Flanders, Belgium	Near Lendestraat	Willie Graham	Bruges	West Flanders	Belgium	Willie Graham 2023	flanders,store,dwelling,gable,stepped gable,dutch gable,window,wall tie,wall anchor,brick,masonry
assets/images/gallery/2020WJG0910_0015.jpg	assets/images/thumbnails/2020WJG0910_0015.jpg	300	200		Whitehall	Whitehall, 1915 Whitehall Road, Annapolis, Anne Arundel County, Maryland	Gov. Horatio Sharpe built Whitehall as a party or banqueting house in the 1760s. Some original design drawings survive, possibly from the hands of Joseph Horatio Anderson who later undertook construction of the Maryland State House. These drawings show the house partially as built but also with features that were not realized until the 20th century. Anderson drafted an octagonal stable, which was reportedly erected.  Dendro (Worhington) for the original build dates to the winter of 1764/65. That work included the main block, with a central cubed room flanked by one story wings. All three rooms were intended as entertaining spaces. The central hall has a vaulted ceiling with elaborate rococo plasterwork and heavily carved woodwork around the walls, doors, and windows. Some of the applied carvings to the walls are original, but heavily repaired in the 1950s. Plasterwork in the cove ceiling was also restored and elaborated at this time. (I presume the central ceiling medallion was wholly made up in the 1950s and that the original treatment is long lost.) The center hall has exquisite, full-length yellow pine flooring and no evidence of carpeting. The flanking rooms probably served as dining room and a parlor-like space. Both are heated, have plaster cornices, and have heavily carved woodwork. These rooms received several generations of carpeting. Since the quality of their flooring was less than the hall, they might have been fitted with them from the outset. The house was intended for entertainments and little accommodation was made for overnight guests, giving the structure a banqueting house like feel, albeit it without cellar service spaces (where the kitchen was placed is unknown for this original construction.) A basement story was created underneath with a passage and two vaulted rooms (probably at least one used for wet storage). Flanking them are two private family chambers. One undoubtedly served as a dining room and has an original beaufat (although its lo	Willie Graham	Anne Arundel Co.	MD	USA	WILLIE GRAHAM 2019	rococco,georgian,classical,5 part house,dwelling,house,plantation,sharpe horation sharpe,gov. sharpe,kitchen,library,collondae,wing,hyphen,brick,masonry
assets/images/gallery/2016wjg1221_0010.jpg	assets/images/thumbnails/2016wjg1221_0010.jpg	300	449	Guaged-and-rubbed work of the frontispiece	Mattaponi Baptist Church	Mattaponi Baptist Church, Stevensville, King and Queen County, Virginia	Constructed began on a new lower church for St. Stephen's Parish in 1730 and was finished about 1734. Built by David Minetree, who incuded his name in a brick mounted near teh east doorway, along with one that presently reads WL but was first made as WN. The N was filled in with hide glue and brick dust and the new L carved over it presumably during original construction. All-glazed header Flemish bond with compass-headed windows and three gauged-and-rubbed frontispieces. The church burned in the early 20th century and so only the brick shell survives. Ray Cannetti, Kevin Nito and Robert Hall are presently restoring the frontispieces.	Willie Graham	King and Queen County	Virginia	USA	Willie Graham 2014	church,brick,masonry,david minetree,minetree,all glazed header,flemish,flemish bond,header,glazed header,frontispiece,pediment,restored,rubbed brick,rubbed,gauged,gauged brick,gauged and rubbed brick
assets/images/gallery/2016wjg1221_0004.jpg	assets/images/thumbnails/2016wjg1221_0004.jpg	300	200	Graffiti on brickwork	Mattaponi Baptist Church	Mattaponi Baptist Church, Stevensville, King and Queen County, Virginia	Constructed began on a new lower church for St. Stephen's Parish in 1730 and was finished about 1734. Built by David Minetree, who incuded his name in a brick mounted near teh east doorway, along with one that presently reads WL but was first made as WN. The N was filled in with hide glue and brick dust and the new L carved over it presumably during original construction. All-glazed header Flemish bond with compass-headed windows and three gauged-and-rubbed frontispieces. The church burned in the early 20th century and so only the brick shell survives. Ray Cannetti, Kevin Nito and Robert Hall are presently restoring the frontispieces. 19th and 2oth-cenury grafitti	Willie Graham	King and Queen County	Virginia	USA	Willie Graham 2014	church,brick,masonry,grafitti
assets/images/gallery/2023WJG0706_2880.jpg	assets/images/thumbnails/2023WJG0706_2880.jpg	300	200	Buildings overlooking square	Markt	Markt, Bruges, West Flanders, Belgium		Willie Graham	Bruges	West Flanders	Belgium	Willie Graham 2023	market,market square,square,flemish,dutch gable,stepped gable,store,dwelling
assets/images/gallery/DJI_0009.jpg	assets/images/thumbnails/DJI_0009.jpg	299	224	Drone shot by Margaret Graham	Paca House	Paca House, 186 Prince George Street, Annapolis, Maryland	Built 1763-65	Willie Graham	Annapolis	MD	USA	Margaret Graham 2018	drone,aerial,landscape,garden,chapel,naval academy chapel,naval academy,five part house,five part palladian house,palladian house
assets/images/gallery/DSC_0862.jpg	assets/images/thumbnails/DSC_0862.jpg	299	199	Farmyard	Skane Farmstead, Skansen	Skane Farmstead, Skansen, Djurgårdsslätten 49-51, 115 21 Stockholm, Sweden	Farmstead representing its use in 1920	Willie Graham	Stockholm		Sweden	Willie Graham 2022	farm,farmstead,thatch roof
assets/images/gallery/2023WJG0208_0094.jpg	assets/images/thumbnails/2023WJG0208_0094.jpg	300	450	Kitchen with remains of early stove	Indian Range	Indian Range, 1012 Mount Airy Road, Davidsonville, Anne Arundel County, Maryland	Two-story house built on a large rural estate in a design at least inspired by the work of Downing and Davis. Constructed about 1850. Center-passage plan with drawing room on one side of the passage and dining room and library on the other. Rear/side service wing includes intermediate space possibly for staging food, carriage house, and kitchen on the extreme end. Two quarters in the attic above the carriage house and kitchen--one heated with a stove, the other not. Passage leads from the unheated quarter to the second floor of the house. Leibrandt & McDowell Stove Company. Philadelphia & Baltimore.	Willie Graham	Anne Arundel Co.	MD	USA	WILLIE GRAHAM 2023	house,dwelling,a j davis,downing,davis and downing,frame,timber frame,gothic,kitchen,service,service wing,gothic revival,stove,leibrandt & mcdowell stove company,cast iron,cook,cokking,service
assets/images/gallery/2023WJG1003_0110.jpg	assets/images/thumbnails/2023WJG1003_0110.jpg	299	449	Detail of the parlor mantel and plaster paneling	John Ridout House	John Ridout House, 120 Duke of Gloucester Street, Annapolis, Anne Arundel County, Maryland	Built 1764-65 by John Ridout. Detail of parlor mantel. Chairboard was removed probably early 20th century and recreated in the early 1950s.	Willie Graham	Annapolis	MD	USA	WILLIE GRAHAM 2023	house,dwelling,ridout,john ridout,parlor,mantel,plaster paneling,carve,carving,marble,backband,acanthus leaf
assets/images/gallery/2023WJG0927_0001.jpg	assets/images/thumbnails/2023WJG0927_0001.jpg	300	450	18835 porch detail	Four Mile Tree	Four Mile Tree, 7741 Swanns Point Road, Spring Grove, Surry County, Virginia	Trees cut to build the house between the summer of 1743 and the winter of 1744/45. Seemingly completed in 1745. The parlor was remodeled in 1796 (dendro spring 1796); Phillip St. George Cocke remdeled the house in 1835.	Willie Graham	Surry Co.	VA	USA	WILLIE GRAHAM 2023	house,dwelling,porch,pilaster,window,stucco,brick,masonry
assets/images/gallery/2009wjg0418_0097.jpg	assets/images/thumbnails/2009wjg0418_0097.jpg	299	212	Sand cast and water struck brick ballast used in construction	Newington	Newington King and Queen County Virginia. Stone House, probably ca, 1760	Newington Stone Building, King and Queen County, VA. Photograph by Willie Graham 2009.	Willie Graham	King and Queen County	Virginia	USA	Willie Graham 2009	stone,outbuilding,ballast,masonry,brick,ruin,store,storehouse,bricks,water struck,sand cast,glaze,glazing
assets/images/gallery/2023WJG1218_0282.jpg	assets/images/thumbnails/2023WJG1218_0282.jpg	300	200	Wrought sprig used as armature to hold acanthus leaf;  pllaster 	John Ridout House	John Ridout House, 120 Duke of Gloucester Street, Annapolis, Anne Arundel County, Maryland	Built 1764-65 by John Ridout. Detail of office. Plaster cornice in drawing room being conserved by Chris Mills. Lime plaster except for the modillions, which are cast in plaster of Paris. All other enrichment is lime plaster.	Willie Graham	Annapolis	MD	US	Willie Graham 2023	house,dwelling,ridout,john ridout,drawing room,plaster,lime plaster,plaster of paris,gypsum,cornice,cast plaster,run in place plaster,enrich,bed mold,acanthus,armature,dogwood flower
assets/images/gallery/21-003.jpg	assets/images/thumbnails/21-003.jpg	299	197	Date brick before digital enhancement of image	Marlboro	Marlboro, King and Queen County, Virginia	Date brick DCM 1805 on chimney. Frame house with gable roof on front slope and gambrel on rear. Built with Double-struck, hand-headed cut nails. Scan from slide, dated January 2000	Willie Graham	King and Queen Co.	VA	USA	Willie Graham 2000	nail,double struck,cut nail,hand headed,brick,date brick,inscription,date
assets/images/gallery/2023WJG0208_0121 b&w.jpg	assets/images/thumbnails/2023WJG0208_0121 b&w.jpg	299	449	Rear stairs to carriage room	Indian Range	Indian Range, 1012 Mount Airy Road, Davidsonville, Anne Arundel County, Maryland	Two-story house built on a large rural estate in a design at least inspired by the work of Downing and Davis. Constructed about 1850. Center-passage plan with drawing room on one side of the passage and dining room and library on the other. Rear/side service wing includes intermediate space possibly for staging food, carriage house, and kitchen on the extreme end. Two quarters in the attic above the carriage house and kitchen--one heated with a stove, the other not. Passage leads from the unheated quarter to the second floor of the house.	Willie Graham	Anne Arundel Co.	MD	USA	WILLIE GRAHAM 2023	house,dwelling,a j davis,downing,davis and downing,frame,timber frame,gothic,steps,granite,door,doorway,carriage,carriage room,carriage house,gothic revival
assets/images/gallery/2023WJG0208_0099.jpg	assets/images/thumbnails/2023WJG0208_0099.jpg	300	200	Rear wall of kitchen	Indian Range	Indian Range, 1012 Mount Airy Road, Davidsonville, Anne Arundel County, Maryland	Two-story house built on a large rural estate in a design at least inspired by the work of Downing and Davis. Constructed about 1850. Center-passage plan with drawing room on one side of the passage and dining room and library on the other. Rear/side service wing includes intermediate space possibly for staging food, carriage house, and kitchen on the extreme end. Two quarters in the attic above the carriage house and kitchen--one heated with a stove, the other not. Passage leads from the unheated quarter to the second floor of the house.	Willie Graham	Anne Arundel Co.	MD	USA	WILLIE GRAHAM 2023	house,dwelling,a j davis,downing,davis and downing,frame,timber frame,gothic,kitchen,service,service wing,gothic revival
assets/images/gallery/2017wjg0208_0039.jpg	assets/images/thumbnails/2017wjg0208_0039.jpg	300	449	Open string staircase	Ellerslie	Ellerslie, Bacon's Castle Trail, Surry County, Virginia	Two-story frame house, center passage plan. Mix of hand-forged wrought-iron nails and double struck machine cut nails. Lath nails are cut with flat heads. Riven lath. Georgian-style moldings. Cast-iron butt hinges except for a pair of H hinges on door under stair. CLosed string stair with square balusters. Thin muntins. Wainscot in most rooms--mix of flat, recessed panels and raised panels. Double chimneys on both ends connected to each other but pierced with a central window on the first floor and a cellar entry on the east side.3/1 American bond foundations and chimney. Hewn and pit sawn timbers; gauged and undercut flooring. c. 1805	Willie Graham	Surry County	Virginia	USA	Willie Graham 2014	dwelling,frame,two story,stair,rail,balustrade,baluster,square baluster,newel,post,handrail,square baluster,closed string
assets/images/gallery/WJG_3044_0160 b&w.jpg	assets/images/thumbnails/WJG_3044_0160 b&w.jpg	299	449	Kitchen stair enclosure	Cliveden Kitchen-Quarter	Cliveden Kitchen-Quarter, 6401 Germantown Avenue, Philadelphia, Pennsylvania	Built 1763-65 for Benjamin Chew. Builders: Jacob Knorr and John Hesser	Willie Graham	Philadelphia	PA	USA	Willie Graham 2023	kitchen,quarter,stair
assets/images/gallery/2023WJG0504_0107.jpg	assets/images/thumbnails/2023WJG0504_0107.jpg	300	200	Graffiti on quoins	All Hallows Parish Church	All Hallows Parish Church, 3600 Solomons Island Road, Edgewater, Anne Arundel County, Maryland	Built  1727; altered c. 1825; 1885; burned and rebuilt, 1940. Original brick porch on south; original vestry room on west. Door also on north opposite main south door but filled in in the 19th century.	Willie Graham	Anne Arundel Co.	MD	USA	WILLIE GRAHAM 2022	church,brick,masonry,graffiti,quoin,brick quoin,cut and rub,gauged and rubbed,rubbed,rubbed brick
assets/images/gallery/2023WJG0706_3015 b&w.jpg	assets/images/thumbnails/2023WJG0706_3015 b&w.jpg	300	450	Balcony	St. Salvador	St. Salvador Cathedral, Bruges, West Flanders, Belgium		Willie Graham	Bruges	West Flanders	Belgium	Willie Graham 2023	balcony,baroque,carve,carving,order,composite order,composite,rail,railing,baluster,cherub
assets/images/gallery/DSC_0853.jpg	assets/images/thumbnails/DSC_0853.jpg	299	199		Skogaholm Manor, Skansen	Skogaholms Manor, Skansen, Djurgårdsslätten 49-51, 115 21 Stockholm, Sweden	panel; paneling; wainscot; wainsoting; interior; drawing room; hearth; mantel; fireplace	Willie Graham	Stockholm		Sweden	Willie Graham 2022	
assets/images/gallery/2016wjg1221_0009.jpg	assets/images/thumbnails/2016wjg1221_0009.jpg	300	200	Signed brickwork over gauged and rubbed arch	Mattaponi Baptist Church	Mattaponi Baptist Church, Stevensville, King and Queen County, Virginia	Constructed began on a new lower church for St. Stephen's Parish in 1730 and was finished about 1734. Built by David Minetree, who incuded his name in a brick mounted near teh east doorway, along with one that presently reads WL but was first made as WN. The N was filled in with hide glue and brick dust and the new L carved over it presumably during original construction. All-glazed header Flemish bond with compass-headed windows and three gauged-and-rubbed frontispieces. The church burned in the early 20th century and so only the brick shell survives. Ray Cannetti, Kevin Nito and Robert Hall are presently restoring the frontispieces. Segmental windows with I M O HOGG perhaps for James O Hogg) and WB initials carved into arches.	Willie Graham	King and Queen County	Virginia	USA	Willie Graham 2014	church,brick,masonry,david minetree,minetree,hogg,wb,grafitti,initials,carve,gauge,rub,gauged,rubbed,gauged and rubbed,arch,segmental,compass head
assets/images/gallery/2017wjg0208_0005.jpg	assets/images/thumbnails/2017wjg0208_0005.jpg	300	200	Brick detail	Ellerslie	Ellerslie, Bacon's Castle Trail, Surry County, Virginia	Two-story frame house, center passage plan. Mix of hand-forged wrought-iron nails and double struck machine cut nails. Lath nails are cut with flat heads. Riven lath. Georgian-style moldings. Cast-iron butt hinges except for a pair of H hinges on door under stair. CLosed string stair with square balusters. Thin muntins. Wainscot in most rooms--mix of flat, recessed panels and raised panels. Double chimneys on both ends connected to each other but pierced with a central window on the first floor and a cellar entry on the east side.3/1 American bond foundations and chimney. Hewn and pit sawn timbers; gauged and undercut flooring. c. 1805. Chimney brickwork painted red at an early date and later whitewashed	Willie Graham	Surry County	Virginia	USA	Willie Graham 2014	dwelling,frame,two story,brick,chimney,ameican bond,double stack
assets/images/gallery/2020WJG0910_0018.jpg	assets/images/thumbnails/2020WJG0910_0018.jpg	299	199		Whitehall	Whitehall, 1915 Whitehall Road, Annapolis, Anne Arundel County, Maryland	Gov. Horatio Sharpe built Whitehall as a party or banqueting house in the 1760s. Some original design drawings survive, possibly from the hands of Joseph Horatio Anderson who later undertook construction of the Maryland State House. These drawings show the house partially as built but also with features that were not realized until the 20th century. Anderson drafted an octagonal stable, which was reportedly erected.  Dendro (Worhington) for the original build dates to the winter of 1764/65. That work included the main block, with a central cubed room flanked by one story wings. All three rooms were intended as entertaining spaces. The central hall has a vaulted ceiling with elaborate rococo plasterwork and heavily carved woodwork around the walls, doors, and windows. Some of the applied carvings to the walls are original, but heavily repaired in the 1950s. Plasterwork in the cove ceiling was also restored and elaborated at this time. (I presume the central ceiling medallion was wholly made up in the 1950s and that the original treatment is long lost.) The center hall has exquisite, full-length yellow pine flooring and no evidence of carpeting. The flanking rooms probably served as dining room and a parlor-like space. Both are heated, have plaster cornices, and have heavily carved woodwork. These rooms received several generations of carpeting. Since the quality of their flooring was less than the hall, they might have been fitted with them from the outset. The house was intended for entertainments and little accommodation was made for overnight guests, giving the structure a banqueting house like feel, albeit it without cellar service spaces (where the kitchen was placed is unknown for this original construction.) A basement story was created underneath with a passage and two vaulted rooms (probably at least one used for wet storage). Flanking them are two private family chambers. One undoubtedly served as a dining room and has an original beaufat (although its lo	Willie Graham	Anne Arundel Co.	MD	USA	WILLIE GRAHAM 2019	rococco,georgian,classical,5 part house,dwelling,house,plantation,sharpe horation sharpe,gov. sharpe,brick,masonry,tuckpoint,struck,mortar,flemish bond,closer,header,stretcher,rub,rubbed brick
assets/images/gallery/2023WJG0208_0072.jpg	assets/images/thumbnails/2023WJG0208_0072.jpg	299	449	Clark Balto. mortise lock, drawing room door	Indian Range	Indian Range, 1012 Mount Airy Road, Davidsonville, Anne Arundel County, Maryland	Two-story house built on a large rural estate in a design at least inspired by the work of Downing and Davis. Constructed about 1850. Center-passage plan with drawing room on one side of the passage and dining room and library on the other. Rear/side service wing includes intermediate space possibly for staging food, carriage house, and kitchen on the extreme end. Two quarters in the attic above the carriage house and kitchen--one heated with a stove, the other not. Passage leads from the unheated quarter to the second floor of the house.	Willie Graham	Anne Arundel Co.	MD	USA	WILLIE GRAHAM 2023	house,dwelling,lock,hardware,mortise lock,brass,clark,j clark,baltimore,j clark hardware maker
assets/images/gallery/2023WJG0208_0066.jpg	assets/images/thumbnails/2023WJG0208_0066.jpg	300	200	Early pry bar discovered in roof frame	Indian Range	Indian Range, 1012 Mount Airy Road, Davidsonville, Anne Arundel County, Maryland	Two-story house built on a large rural estate in a design at least inspired by the work of Downing and Davis. Constructed about 1850. Center-passage plan with drawing room on one side of the passage and dining room and library on the other. Rear/side service wing includes intermediate space possibly for staging food, carriage house, and kitchen on the extreme end. Two quarters in the attic above the carriage house and kitchen--one heated with a stove, the other not. Passage leads from the unheated quarter to the second floor of the house. Photo of early pry bar discovered in the roof frame under the shingles	Willie Graham	Anne Arundel Co.	MD	USA	WILLIE GRAHAM 2023	house,dwelling,tool,wrought iron,pry bar,roof
assets/images/gallery/2011wjg1112_0138.jpg	assets/images/thumbnails/2011wjg1112_0138.jpg	299	198	Rear of building; Robison outbuilding to right	Aiken-Rhett Kitchen/Quarter	Aiken Rhett Kitchen/Quarter, 48 Elizabeth Street, Charleston, Charleston County, South Carolina	built ca. 1818; improved ca. 1836; 1857-8	Willie Graham	Charleston	SC	USA	Willie Graham 2011	wall,flemish bond,cap
assets/images/gallery/2021WJG0810_0603.jpg	assets/images/thumbnails/2021WJG0810_0603.jpg	299	199	Mid 19th-century log quarter	Edgehill Slave House	Edgehill Slave House, 4920 Griffith Road, Gaithersburg, Montgomery County, Maryland	Slave house built with a group of outbuildings around 1845-65	Willie Graham	Montgomery Co.	MD	USA	WILLIE GRAHAM 2021	house,dwelling,slave house,slave,enslaved,log,log dwelling,log house,quarter,slave quarter,one and a half story,1 1/2 story,chimney,enslave,notch,v notch,hew,hewn
assets/images/gallery/2021WJG0810_0617.jpg	assets/images/thumbnails/2021WJG0810_0617.jpg	299	199	Hand-forged strap hinge	Edgehill Slave House	Edgehill Slave House, 4920 Griffith Road, Gaithersburg, Montgomery County, Maryland	Slave house built with a group of outbuildings around 1845-65	Willie Graham	Montgomery Co.	MD	USA	WILLIE GRAHAM 2021	house,dwelling,slave house,slave,enslaved,enslave quarter,door,rose head nail,board and batten,board and batten door,leaf,door leaf,hinge,hand forge,wrought iron,strap hinge,pintle
assets/images/gallery/2023WJG0208_0106.jpg	assets/images/thumbnails/2023WJG0208_0106.jpg	299	199	Carriage room	Indian Range	Indian Range, 1012 Mount Airy Road, Davidsonville, Anne Arundel County, Maryland	Two-story house built on a large rural estate in a design at least inspired by the work of Downing and Davis. Constructed about 1850. Center-passage plan with drawing room on one side of the passage and dining room and library on the other. Rear/side service wing includes intermediate space possibly for staging food, carriage house, and kitchen on the extreme end. Two quarters in the attic above the carriage house and kitchen--one heated with a stove, the other not. Passage leads from tehe unheated quarter to the second floor of the house.	Willie Graham	Anne Arundel Co.	MD	USA	WILLIE GRAHAM 2023	house,dwelling,a j davis,downing,davis and downing,frame,timber frame,gothic,carriage,carriage room,service,service wing,gothic revival
assets/images/gallery/2009wjg0409_0023.jpg	assets/images/thumbnails/2009wjg0409_0023.jpg	299	445	Holes in stonework where shelf brackets were once located	Newington	Newington Stone Building King and Queen County Virginia	Newington Stone Building, King and Queen County, VA. Photograph by Willie Graham 2009.	Willie Graham	King and Queen County	Virginia	USA	Willie Graham 2009	stone,outbuilding,ballast,masonry,brick,ruin,store,storehouse,shelf,bracket,shelving,lime,mortar,shell lime
assets/images/gallery/2023WJG0706_3067 b&w.jpg	assets/images/thumbnails/2023WJG0706_3067 b&w.jpg	300	200		Oude Gentweg 27-29	Oude Gentweg 27-29, Bruges, West Flanders, Belgium		Willie Graham	Bruges	West Flanders	Belgium	Willie Graham 2023	flanders,row house,townhouse,town house,brick,masonry,gable,dutch gable,stepped gable,window
