path	tpath	twidth	theight	title	location	headline	description	creator	city	state	country	copyright	categories
assets/images/gallery/2018wjg0521_0009.jpg	assets/images/thumbnails/2018wjg0521_0009.jpg	300	449	Chief's House, built about 1885, before restoration	Chief's House	Chief's House, Sunnyside Road, St. Stephen's Church Vicinity, King and Queen County, Virginia	Built about 1885 as a two-room, board-and-batten structure. Weatherboard, detached, frame kitchen built soon thereafter. About 1920 the kitchen was expanded and a front added tothe house, which connected it to the kitchen.Attic over the ca. 1920 extension; common rafter with a ridge board. Follows the 12/12 pitche of the adjoining, earlier section	Willie Graham	King and Queen Co.	VA	USA	Willie Graham 2017	chief,indian,mattaponi,house,apothocary,attic,rafter,common rafter
assets/images/gallery/2011wjg1112_0156.jpg	assets/images/thumbnails/2011wjg1112_0156.jpg	299	452	View from end quarter down corridor	Aiken-Rhett Kitchen/Quarter	Aiken Rhett Kitchen/Quarter, 48 Elizabeth Street, Charleston, Charleston County, South Carolina	built ca. 1818; improved ca. 1836; 1857-8	Willie Graham	Charleston	SC	USA	Willie Graham 2011	kitchen,quarter,slave quarter,slave house,enslave,enslaved,slave,door,[passage,corridor,rob light
assets/images/gallery/2023WJG0706_2820.jpg	assets/images/thumbnails/2023WJG0706_2820.jpg	299	199	Street view	Ostmeers	Street scene, Oostmeers, Bruges, West Flanders, Belgium		Willie Graham	Bruges	West Flanders	Belgium	Willie Graham 2023	house,dwelling,shop,gable,cross gable,gambrel roof,flemish,dormer
assets/images/gallery/2020WJG0910_0062.jpg	assets/images/thumbnails/2020WJG0910_0062.jpg	300	200		Whitehall	Whitehall, 1915 Whitehall Road, Annapolis, Anne Arundel County, Maryland	Gov. Horatio Sharpe built Whitehall as a party or banqueting house in the 1760s. Some original design drawings survive, possibly from the hands of Joseph Horatio Anderson who later undertook construction of the Maryland State House. These drawings show the house partially as built but also with features that were not realized until the 20th century. Anderson drafted an octagonal stable, which was reportedly erected.  Dendro (Worhington) for the original build dates to the winter of 1764/65. That work included the main block, with a central cubed room flanked by one story wings. All three rooms were intended as entertaining spaces. The central hall has a vaulted ceiling with elaborate rococo plasterwork and heavily carved woodwork around the walls, doors, and windows. Some of the applied carvings to the walls are original, but heavily repaired in the 1950s. Plasterwork in the cove ceiling was also restored and elaborated at this time. (I presume the central ceiling medallion was wholly made up in the 1950s and that the original treatment is long lost.) The center hall has exquisite, full-length yellow pine flooring and no evidence of carpeting. The flanking rooms probably served as dining room and a parlor-like space. Both are heated, have plaster cornices, and have heavily carved woodwork. These rooms received several generations of carpeting. Since the quality of their flooring was less than the hall, they might have been fitted with them from the outset. The house was intended for entertainments and little accommodation was made for overnight guests, giving the structure a banqueting house like feel, albeit it without cellar service spaces (where the kitchen was placed is unknown for this original construction.) A basement story was created underneath with a passage and two vaulted rooms (probably at least one used for wet storage). Flanking them are two private family chambers. One undoubtedly served as a dining room and has an original beaufat (although its lo	Willie Graham	Anne Arundel Co.	MD	USA	WILLIE GRAHAM 2019	rococco,georgian,classical,5 part house,dwelling,house,plantation,sharpe horation sharpe,gov. sharpe,parlor,mantel,chimneypiece,mantel piece,marble,carve,carving,shelf,entablature,chair board
assets/images/gallery/2020WJG0910_0089.jpg	assets/images/thumbnails/2020WJG0910_0089.jpg	300	200	Wrought-iron grille in wine vault door	Whitehall	Whitehall, 1915 Whitehall Road, Annapolis, Anne Arundel County, Maryland	Gov. Horatio Sharpe built Whitehall as a party or banqueting house in the 1760s. Some original design drawings survive, possibly from the hands of Joseph Horatio Anderson who later undertook construction of the Maryland State House. These drawings show the house partially as built but also with features that were not realized until the 20th century. Anderson drafted an octagonal stable, which was reportedly erected.  Dendro (Worhington) for the original build dates to the winter of 1764/65. That work included the main block, with a central cubed room flanked by one story wings. All three rooms were intended as entertaining spaces. The central hall has a vaulted ceiling with elaborate rococo plasterwork and heavily carved woodwork around the walls, doors, and windows. Some of the applied carvings to the walls are original, but heavily repaired in the 1950s. Plasterwork in the cove ceiling was also restored and elaborated at this time. (I presume the central ceiling medallion was wholly made up in the 1950s and that the original treatment is long lost.) The center hall has exquisite, full-length yellow pine flooring and no evidence of carpeting. The flanking rooms probably served as dining room and a parlor-like space. Both are heated, have plaster cornices, and have heavily carved woodwork. These rooms received several generations of carpeting. Since the quality of their flooring was less than the hall, they might have been fitted with them from the outset. The house was intended for entertainments and little accommodation was made for overnight guests, giving the structure a banqueting house like feel, albeit it without cellar service spaces (where the kitchen was placed is unknown for this original construction.) A basement story was created underneath with a passage and two vaulted rooms (probably at least one used for wet storage). Flanking them are two private family chambers. One undoubtedly served as a dining room and has an original beaufat (although its lo	Willie Graham	Anne Arundel Co.	MD	USA	WILLIE GRAHAM 2019	georgian,classical,5 part house,dwelling,house,plantation,sharpe,horation sharpe,gov. sharpe,grille,wrought iron,hand forged,cellar,door,storage,wine,wet storage,vault
assets/images/gallery/2011wjg1112_0022.jpg	assets/images/thumbnails/2011wjg1112_0022.jpg	299	198	Stable fittings, 1830s	Aiken Rhett Stable	Aiken Rhett Stable, 48 Elizabeth Street, Charleston, Charleston County, South Carolina	Stable built ca. 1818; enlarged ca. 1836; ca. 1857-8. 	Willie Graham	Charleston	SC	USA	Willie Graham 2011	stable,interior,manger,feed,trough,colonnade,horse
assets/images/gallery/2017wjg0208_0043.jpg	assets/images/thumbnails/2017wjg0208_0043.jpg	300	200	Interior	Ellerslie	Ellerslie, Bacon's Castle Trail, Surry County, Virginia	Two-story frame house, center passage plan. Mix of hand-forged wrought-iron nails and double struck machine cut nails. Lath nails are cut with flat heads. Riven lath. Georgian-style moldings. Cast-iron butt hinges except for a pair of H hinges on door under stair. CLosed string stair with square balusters. Thin muntins. Wainscot in most rooms--mix of flat, recessed panels and raised panels. Double chimneys on both ends connected to each other but pierced with a central window on the first floor and a cellar entry on the east side.3/1 American bond foundations and chimney. Hewn and pit sawn timbers; gauged and undercut flooring. c. 1805. Second floor bedchamber, west, rear. Door to front chmaber added in 20th century.	Willie Graham	Surry County	Virginia	USA	Willie Graham 2014	dwelling,frame,two story,chamber,bedchamber,mantel
assets/images/gallery/2023WJG0706_3082.jpg	assets/images/thumbnails/2023WJG0706_3082.jpg	300	200		Driekroezenstraat 1-9	Driekroezenstraat 1-9, Brugse, West Flanders, Belgium	17th-century row	Willie Graham	Bruges	West Flanders	Belgium	Willie Graham 2023	house,row house,dwelling,townhouse,town house,flanders,gable,dutch gable,stepped gable,alley
assets/images/gallery/DSC_1074.jpg	assets/images/thumbnails/DSC_1074.jpg	300	451			Riddarholmen Church, Birger Jarls Torg 2, 112 28, Stockholm, Sweden	From Wikipedia: Riddarholmen Church (Swedish: Riddarholmskyrkan) is the church of the former medieval Greyfriars Monastery in Stockholm, Sweden. The church serves as the final resting place of most Swedish monarchs. Riddarholmen Church is located on the island of Riddarholmen, close to the Royal Palace in Stockholm, Sweden. The congregation was dissolved in 1807 and today the church is used only for burial and commemorative purposes. Swedish monarchs from Gustavus Adolphus (d. 1632 AD) to Gustaf V (d. 1950) are entombed here (with only one exception: Queen Christina who is buried within St. Peter's Basilica in Rome), as well as the earlier monarchs Magnus III (d. 1290) and Charles VIII (d. 1470). It has been discontinued as a royal burial site in favor of the Royal Cemetery and today is run by departments of the Swedish Government and Royal Court. It is one of the oldest buildings in Stockholm, parts of it dating to the late-13th century, when it was built as a greyfriars monastery. After the Protestant Reformation, the monastery was closed and the building became a Lutheran church. A spire designed by Flemish architect Willem Boy (1520–1592) was added during the reign of John III, but it was destroyed by a lightning strike on July 28, 1835, after which it was replaced with the present cast-iron spire.  Coats of arms of knights of the Royal Order of the Seraphim are on the walls of the church. When a knight of the Order dies, his coat of arms is hung in the church and when the funeral takes place the church's bells are rung without pause from 12:00 to 13:00.	Willie Graham	Stockholm		Sweden	Willie Graham 2022	church,medieval,spire,cast iron,chapel
assets/images/gallery/2023WJG0706_3041.jpg	assets/images/thumbnails/2023WJG0706_3041.jpg	300	200	Three-quarter view	Oostmeers 36	Oostmeers 36, Bruges, Flanders, Belgium		Willie Graham	Bruges	West Flanders	Belgium	Willie Graham 2023	cross gable,dutch gable,flemish,brick,masonry,dwelling,store,dutch roof,gambrel roof
assets/images/gallery/2023WJG0706_3069.jpg	assets/images/thumbnails/2023WJG0706_3069.jpg	299	449	Street view	Oude Gentweg 37	Oude Gentweg 37, Bruges, West Flanders, Belgium		Willie Graham	Bruges	West Flanders	Belgium	Willie Graham 2023	row house,townhouse,town house,dwelling,gable,cross gable,stepped gable,g
assets/images/gallery/2012wjg0904_1260b&w.jpg	assets/images/thumbnails/2012wjg0904_1260b&w.jpg	299	198	Original cricket construction against the chimney	Salubria	Salubria, 19173 Salubria Ln, Stevensburg, Culpeper County, Virginia 	Dendro date for construction of Saulbiira: 1757		Culpeper County	VA	USA	Willie Graham 2012	cricket,roof,lath
assets/images/gallery/2023WJG0706_3078 b&w.jpg	assets/images/thumbnails/2023WJG0706_3078 b&w.jpg	300	450	1654 almshouse on alley	House of Our Lady of Woes	House of Our Lady of Seven Woes, Driekroezenstraat 2-8, Bruge, West Flanders, Belgium	Former almshouses seemingly constructed in 1654. Located on the corner with Oude Gentweg 8. Former alms house O.-L.-V. VAN DE ZEVEN WEEËN / 1654 see painted inscription. Existing houses purchased in 1653 by founders Maria de Damhouder and Joost van der Straeten and furnished as a house of worship in 1654-1655, see partly weathered gable stone with (almost illegible) date 1654 as the keystone of the door frame. In 1951: adaptation of the original, high-placed windows to the current ones. 1979: conversion of houses into four residential units by architect E. Vyncke. https://inventaris.onroerenderfgoed.be/erfgoedobjecten/81852	Willie Graham	Bruges	West Flanders	Belgium	Willie Graham 2023	almshouse,poor house,godshuis,alley,alleyway,gable,cross gable,stepped gable,tie,wall tie,brick,masonry,dwelling,dutch gable
assets/images/gallery/2023WJG0706_3100 b&w.jpg	assets/images/thumbnails/2023WJG0706_3100 b&w.jpg	300	200	Street front	Borgarden Kapel Museum	Borgarden Kapel Museum, Katelinjnextraat 83, Bruges, West Flanders, Belgium	1572	Willie Graham	Bruges	West Flanders	Belgium	Willie Graham 2023	museum,flanders,brick,masonry,gable,dormer,stepped gable,dutch gable,chapel
assets/images/gallery/2021WJG0412_0030.jpg	assets/images/thumbnails/2021WJG0412_0030.jpg	299	199	Double-ogee gauged-and-rubbed arch over door	Holly Hill	Holly Hill, 333 Friendship Road, Friendship, Anne Arundel County, Maryland	Built 1698-99 as a hall/parlor frame dwelling with clapboard walls and roof and casement windows; improved 1713; ca. 1730. Hand carved arch over door.	Willie Graham	Anne Arundel Co.	MD	USA	WILLIE GRAHAM 2019	house,dwelling,cornice,modillion,bed molding,arch,ogee,double ogee,cyma,window,gauge and rub,gauged and rubbed arch
assets/images/gallery/2023WJG1003_0110 b&w.jpg	assets/images/thumbnails/2023WJG1003_0110 b&w.jpg	299	449	Detail of the parlor mantel and plaster paneling	John Ridout House	John Ridout House, 120 Duke of Gloucester Street, Annapolis, Anne Arundel County, Maryland	Built 1764-65 by John Ridout. Detail of parlor mantel. Chairboard was removed probably early 20th century and recreated in the early 1950s.	Willie Graham	Annapolis	MD	USA	WILLIE GRAHAM 2023	house,dwelling,ridout,john ridout,parlor,mantel,plaster paneling,carve,carving,marble,backband,acanthus leaf
assets/images/gallery/2023WJG1003_0114.jpg	assets/images/thumbnails/2023WJG1003_0114.jpg	299	449	Newel detail	John Ridout House	John Ridout House, 120 Duke of Gloucester Street, Annapolis, Anne Arundel County, Maryland	Built 1764-65 by John Ridout. Entry	Willie Graham	Annapolis	MD	USA	WILLIE GRAHAM 2023	house,dwelling,ridout,john ridout,entry,handrail,stair,stairs,baluster,turn,turning,volute,curtail,curtail step
assets/images/gallery/21-022.jpg	assets/images/thumbnails/21-022.jpg	299	419	Strange roof form of a gambrel front and gabled rear; 1805	Marlboro	Marlboro, King and Queen County, Virginia	1805 timber frame house with a common rafter roof made into a gable slope on the front and a gambrel on the rear; rear slope. Scan from slide, dated January 2000	Willie Graham	King and Queen Co.	VA	USA	Willie Graham 2000	roof,frame,common rafter,gambrel,dutch roof,dutch,stud,joist,tie beam,frame,timber frame
assets/images/gallery/2023WJG0706_3087 b&w.jpg	assets/images/thumbnails/2023WJG0706_3087 b&w.jpg	299	449	Entry	St. Joseph Almshouse	St. Joseph Almshouse, Niuewe, Bruges, West Flanders, Belgium	17th-century almshouse--street front to courtyard	Willie Graham	Bruges	West Flanders	Belgium	Willie Graham 2023	dwelling,almshouse,poor house,godshuis,brick,masonry,entry,gable,cross gable,froontispiece,door,niche
assets/images/gallery/2023WJG0927_0005.jpg	assets/images/thumbnails/2023WJG0927_0005.jpg	299	449	Glazed header Flemish bond detail of 1745 house; hidden by 1835 	Four Mile Tree	Four Mile Tree, 7741 Swanns Point Road, Spring Grove, Surry County, Virginia	Trees cut to build the house between the summer of 1743 and the winter of 1744/45. Seemingly completed in 1745. The parlor was remodeled in 1796 (dendro spring 1796); Phillip St. George Cocke remdeled the house in 1835. Detail of original brick showing through1835 on the land front	Willie Graham	Surry Co.	VA	USA	WILLIE GRAHAM 2023	house,dwelling,flemish bond,glazed header,header,glazed,glaszed header flemsih bond,rub,rubbed brick,closer,brick,masonry
assets/images/gallery/2017wjg0208_0018.jpg	assets/images/thumbnails/2017wjg0208_0018.jpg	300	200	Lane by granary	Ellerslie granary	Ellerslie granary, Bacon's Castle Trail, Surry County, Virginia	Frame granary with sheathed interior, wrought-iron, hand-forged hardware. Appears to date to about 1830	Willie Graham	Surry County	Virginia	USA	Willie Graham 2014	granary,storage,frame,agricultural,building,silo
assets/images/gallery/2023WJG0831_0090.jpg	assets/images/thumbnails/2023WJG0831_0090.jpg	300	200	Detail of yellow brick wall, front wall of original wing	Holly Hill	Holly Hill, 338 Friendship Road, Friendship, Anne Arundel County, Maryland	Built as a timber-frame dwelling from timbers cut in 1698; expanded in 1713 (also a dendro date). Brick T added as final phase of Samuel Harrison's work, the expansion recorded in a painting he commissioned before his death in 1733. At the same time, Harrison bricked the front face and gable end of the original wing and its extension. Front of original wing	Willie Graham	Anne Arundel Co.	MD	USA	WILLIE GRAHAM 2023	house,dwelling,flemish bond,yellow brick,iron inclusion,imported brick,ballast
assets/images/gallery/2023WJG0208_0090.jpg	assets/images/thumbnails/2023WJG0208_0090.jpg	300	450	Kitchen with remains of early stove	Indian Range	Indian Range, 1012 Mount Airy Road, Davidsonville, Anne Arundel County, Maryland	Two-story house built on a large rural estate in a design at least inspired by the work of Downing and Davis. Constructed about 1850. Center-passage plan with drawing room on one side of the passage and dining room and library on the other. Rear/side service wing includes intermediate space possibly for staging food, carriage house, and kitchen on the extreme end. Two quarters in the attic above the carriage house and kitchen--one heated with a stove, the other not. Passage leads from the unheated quarter to the second floor of the house. Leibrandt & McDowell Stove Company. Philadelphia & Baltimore.	Willie Graham	Anne Arundel Co.	MD	USA	WILLIE GRAHAM 2023	house,dwelling,a j davis,downing,davis and downing,frame,timber frame,gothic,kitchen,service,service wing,gothic revival,stove,leibrandt & mcdowell stove company,cast iron,cook,cokking,service
assets/images/gallery/DJI_0019.jpg	assets/images/thumbnails/DJI_0019.jpg	299	224	Drone Shot by Margaret Graham	Maryland State House	Maryland State House, 1 State Circle, Annapolis, Maryland	Drone shot from Brice House	Willie Graham	Annapolis	MD	USA	Margaret Graham 2018	drone,aerial,landscape
assets/images/gallery/2023WJG0208_0084.jpg	assets/images/thumbnails/2023WJG0208_0084.jpg	300	200	1850s country house inspired by Davis and Downing	Indian Range	Indian Range, 1012 Mount Airy Road, Davidsonville, Anne Arundel County, Maryland	Two-story house built on a large rural estate in a design at least inspired by the work of Downing and Davis. Constructed about 1850. Center-passage plan with drawing room on one side of the passage and dining room and library on the other. Rear/side service wing includes intermediate space possibly for staging food, carriage house, and kitchen on the extreme end. Two quarters in the attic above the carriage house and kitchen--one heated with a stove, the other not. Passage leads from teh unheated quarter to the second floor of the house.	Willie Graham	Anne Arundel Co.	MD	USA	WILLIE GRAHAM 2023	house,dwelling,a j davis,downing,davis and downing,frame,timber frame,gothic,gothic revival,porch,gable
assets/images/gallery/2023WJG0706_2847.jpg	assets/images/thumbnails/2023WJG0706_2847.jpg	299	199	Street view	Steenstraat	Steenstraat, Bruges, West Flanders, Belgium		Willie Graham	Bruges	West Flanders	Belgium	Willie Graham 2023	gable,brick,stepped gable,dutch gable,gable,flanders,store,dwelling,masonry,brick
assets/images/gallery/2020WJG0910_0011.jpg	assets/images/thumbnails/2020WJG0910_0011.jpg	300	200		Whitehall	Whitehall, 1915 Whitehall Road, Annapolis, Anne Arundel County, Maryland	Gov. Horatio Sharpe built Whitehall as a party or banqueting house in the 1760s. Some original design drawings survive, possibly from the hands of Joseph Horatio Anderson who later undertook construction of the Maryland State House. These drawings show the house partially as built but also with features that were not realized until the 20th century. Anderson drafted an octagonal stable, which was reportedly erected.  Dendro (Worhington) for the original build dates to the winter of 1764/65. That work included the main block, with a central cubed room flanked by one story wings. All three rooms were intended as entertaining spaces. The central hall has a vaulted ceiling with elaborate rococo plasterwork and heavily carved woodwork around the walls, doors, and windows. Some of the applied carvings to the walls are original, but heavily repaired in the 1950s. Plasterwork in the cove ceiling was also restored and elaborated at this time. (I presume the central ceiling medallion was wholly made up in the 1950s and that the original treatment is long lost.) The center hall has exquisite, full-length yellow pine flooring and no evidence of carpeting. The flanking rooms probably served as dining room and a parlor-like space. Both are heated, have plaster cornices, and have heavily carved woodwork. These rooms received several generations of carpeting. Since the quality of their flooring was less than the hall, they might have been fitted with them from the outset. The house was intended for entertainments and little accommodation was made for overnight guests, giving the structure a banqueting house like feel, albeit it without cellar service spaces (where the kitchen was placed is unknown for this original construction.) A basement story was created underneath with a passage and two vaulted rooms (probably at least one used for wet storage). Flanking them are two private family chambers. One undoubtedly served as a dining room and has an original beaufat (although its lo	Willie Graham	Anne Arundel Co.	MD	USA	WILLIE GRAHAM 2019	rococco,georgian,classical,5 part house,dwelling,house,plantation,sharpe horation sharpe,gov. sharpe,palladian,banqueting house,party house,brick,masonry
assets/images/gallery/2021WJG0810_0622.jpg	assets/images/thumbnails/2021WJG0810_0622.jpg	300	450	Hand-forged hasp on board-and-batten door	Edgehill Slave House	Edgehill Slave House, 4920 Griffith Road, Gaithersburg, Montgomery County, Maryland	Slave house built with a group of outbuildings around 1845-65	Willie Graham	Montgomery Co.	MD	USA	WILLIE GRAHAM 2021	house,dwelling,slave house,slave,enslaved,enslave quarter,door,rose head nail,board and batten,board and batten door,leaf,door leaf,hasp,wrought iron,hand forge,lock
assets/images/gallery/2021WJG0810_0636.jpg	assets/images/thumbnails/2021WJG0810_0636.jpg	300	450	Log joinery and half-story framing	Edgehill Slave House	Edgehill Slave House, 4920 Griffith Road, Gaithersburg, Montgomery County, Maryland	Slave house built with a group of outbuildings around 1845-65	Willie Graham	Montgomery Co.	MD	USA	WILLIE GRAHAM 2021	house,dwelling,slave house,slave,enslaved,log,log dwelling,log house,quarter,slave quarter,joist,half story 1 1/2 story,one and one half story,v notch
assets/images/gallery/2022WJG1014_0003.jpg	assets/images/thumbnails/2022WJG1014_0003.jpg	299	199	Ailse paving	St. James Goose Creek Parish Chu	St. James Goose Creek Parish Church, 100 Parish Lane, Goose Creek, Berkeley County, South Carolina	Built 1708-19. Repaired after the earthquake of 1886 and after Hurricane Hugo in 1989. The original roof was largely rebuilt seemingly in the late 18th century reusing some of the original timbers reset for different functions. Principal rafter roof without tie beams. 	Willie Graham	Berkelely Co.	SC	USA	WILLIE GRAHAM 2022	church,anglican,episcopal,aisle,paver,stone paver
assets/images/gallery/2009wjg0409_0002.jpg	assets/images/thumbnails/2009wjg0409_0002.jpg	299	445	Brick dressing of opening	Newington	Newington Stone Building King and Queen County Virginia	Newington Stone Building, King and Queen County, VA. Photograph by Willie Graham 2009.	Willie Graham	King and Queen County	Virginia	USA	Willie Graham 2009	stone,outbuilding,ballast,masonry,brick,ruin,store,storehouse
assets/images/gallery/2023WJG0208_0127.jpg	assets/images/thumbnails/2023WJG0208_0127.jpg	299	199	Stair passage	Indian Range	Indian Range, 1012 Mount Airy Road, Davidsonville, Anne Arundel County, Maryland	Two-story house built on a large rural estate in a design at least inspired by the work of Downing and Davis. Constructed about 1850. Center-passage plan with drawing room on one side of the passage and dining room and library on the other. Rear/side service wing includes intermediate space possibly for staging food, carriage house, and kitchen on the extreme end. Two quarters in the attic above the carriage house and kitchen--one heated with a stove, the other not. Passage leads from the unheated quarter to the second floor of the house.	Willie Graham	Anne Arundel Co.	MD	USA	WILLIE GRAHAM 2023	house,dwelling,a j davis,downing,davis and downing,frame,timber frame,gothic,gothic revival,stair,open string,balustrade,newel post,cornice,plaster cornice,ceiling medallion,medallion,decorative plaster,cast plaster,italianate,rococo revival
assets/images/gallery/2009wjg0409_0016.jpg	assets/images/thumbnails/2009wjg0409_0016.jpg	299	201	Storehouse built of rubble stone transported as ballast from Eng	Newington	Newington Stone Building King and Queen County Virginia	Newington Stone Building, King and Queen County, VA. Photograph by Willie Graham 2009.	Willie Graham	King and Queen County	Virginia	USA	Willie Graham 2009	stone,outbuilding,ballast,masonry,brick,ruin,store,storehouse
assets/images/gallery/2016JRH0702153-1.jpg	assets/images/thumbnails/2016JRH0702153-1.jpg	299	222	Floor plan fieldnotes, Willie Graham and Mark Wenger	South River Club	South River Club, South River Clubhouse Road, Harwood, Anne Arundel County, Maryland	South River Club, c. 1742. Measured floor plan field notes by WIllie Graham and Mark R. Wenger	Willie Graham	Anne Arundel Co.	MD	USA	1998	anne arundel county,architecture,dwelling,maryland,south river clubhouse,drawing,fieldnotes,house
